{
  "$schema": "https://json-schema.org/draft/2020-12/schema",
  "$id": "urn:project-gateway:schema:lifecycle:1.0:records:execution-summary-record",
  "title": "ExecutionSummaryRecord",
  "type": "object",
  "required": [
    "record_type",
    "record_id",
    "created_at",
    "responsible_role",
    "registry_snapshot_reference",
    "workspace_id",
    "occurrence_id",
    "attempts"
  ],
  "properties": {
    "record_type": {
      "const": "ExecutionSummaryRecord"
    },
    "record_id": {
      "$ref": "urn:project-gateway:schema:artifact:1.0:common:identifiers#/$defs/lifecycleRecordId"
    },
    "created_at": {
      "$ref": "urn:project-gateway:schema:artifact:1.0:common:identifiers#/$defs/timestamp"
    },
    "responsible_role": {
      "const": "trusted-reporting-authority"
    },
    "registry_snapshot_reference": {
      "$ref": "urn:project-gateway:schema:registry:1.0:registry-snapshot-reference"
    },
    "workspace_id": {
      "$ref": "urn:project-gateway:schema:artifact:1.0:common:identifiers#/$defs/workspaceId"
    },
    "occurrence_id": {
      "$ref": "urn:project-gateway:schema:artifact:1.0:common:identifiers#/$defs/occurrenceId"
    },
    "attempts": {
      "type": "array",
      "minItems": 1,
      "maxItems": 64,
      "items": {
        "type": "object",
        "required": [
          "attempt_id",
          "ordinal",
          "receipt_record_ids",
          "result_publication_record_id"
        ],
        "properties": {
          "attempt_id": {
            "$ref": "urn:project-gateway:schema:artifact:1.0:common:identifiers#/$defs/attemptId"
          },
          "ordinal": {
            "type": "integer",
            "minimum": 1,
            "maximum": 64
          },
          "receipt_record_ids": {
            "type": "array",
            "minItems": 1,
            "maxItems": 16,
            "uniqueItems": true,
            "items": {
              "$ref": "urn:project-gateway:schema:artifact:1.0:common:identifiers#/$defs/lifecycleRecordId"
            }
          },
          "result_publication_record_id": {
            "oneOf": [
              {
                "type": "null"
              },
              {
                "$ref": "urn:project-gateway:schema:artifact:1.0:common:identifiers#/$defs/lifecycleRecordId"
              }
            ]
          }
        },
        "unevaluatedProperties": false
      }
    }
  },
  "unevaluatedProperties": false
}
