{
  "record_type": "ExecutionSummaryRecord",
  "record_id": "pgw:l:65925108d2b7c2cb299504e6d9201f36",
  "created_at": "2026-08-04T06:01:00.000Z",
  "responsible_role": "trusted-reporting-authority",
  "registry_snapshot_reference": {
    "registry_protocol_id": "project-gateway.registry",
    "registry_snapshot_format_version": "1.0",
    "registry_snapshot_id": "pgw:g:3fb51a11f2b23ba8c171326cbba7eb64",
    "registry_snapshot_digest": "sha-256:613112612ee7803db00c6e51826b3a63ee6ce6732b17c9b09ae8aff00db47c05",
    "protocol_compatibility": {
      "mode": "exact-release",
      "artifact_protocol_id": "project-gateway.artifact",
      "artifact_protocol_version": "1.0"
    }
  },
  "workspace_id": "pgw:w:cf4339b1f56441936467dea1357dc30e",
  "occurrence_id": "pgw:o:07afc217d096ca56baa8fe7441667a7a",
  "attempts": [
    {
      "attempt_id": "pgw:a:b17466cc359d45120cf977b1c506ab81",
      "ordinal": 1,
      "receipt_record_ids": [
        "pgw:l:d98879735ae0ebe7072123f55e2cb06a"
      ],
      "result_publication_record_id": "pgw:l:0f86561945fd788cb719f2d5b8e81ccd"
    },
    {
      "attempt_id": "pgw:a:803e00ec31985c5549122aad6ea922dc",
      "ordinal": 2,
      "receipt_record_ids": [
        "pgw:l:9a398536ec47cefb75b87217e2981705"
      ],
      "result_publication_record_id": null
    }
  ]
}
